[
  {
    "id": "A1",
    "inputText": "喝水",
    "description": "单词直接表达需求（SCA 极短句式）。「喝水」是种子库精确标签，期望 matchRate=1.0。",
    "evidence": [
      { "source": "SCA", "note": "失语症患者常以单词代替完整句表达需求" },
      { "source": "Widgit-26", "note": "Hemsley 26 critical phrases: I'm thirsty / I need a drink" },
      { "source": "AsTeRICS-Hospital", "note": "Need_to_drink grid 核心词" }
    ],
    "testFocus": "单 token 精确匹配基线",
    "expectedTokens": [
      { "token": "喝水", "matchType": "exact", "labelZh": "喝水" }
    ],
    "minMatchRate": 1.0
  },
  {
    "id": "A2",
    "inputText": "我渴",
    "description": "2 字极短句（我 + 状态词）。两词均在种子库，期望 matchRate=1.0。",
    "evidence": [
      { "source": "SCA", "note": "2 字短句是失语症患者真实表达常态" },
      { "source": "Lingraphica-ICU", "note": "ICU 需求板块：thirsty 状态表达" },
      { "source": "2023-Mandarin", "note": "「渴」在台湾普通话核心词频研究 100 词内" }
    ],
    "testFocus": "2 token 全精确匹配",
    "expectedTokens": [
      { "token": "我", "matchType": "exact", "labelZh": "我" },
      { "token": "渴", "matchType": "exact", "labelZh": "渴" }
    ],
    "minMatchRate": 1.0
  },
  {
    "id": "A3",
    "inputText": "去厕所",
    "description": "2 字动宾结构（动词 + 地点）。两词均在种子库，期望 matchRate=1.0。",
    "evidence": [
      { "source": "SCA", "note": "动宾极短句式：行为 + 目标地点" },
      { "source": "Widgit-26", "note": "Hemsley 26: I need the toilet — 最高优先级基本需求" },
      { "source": "AsTeRICS-Hospital", "note": "Need_for_toilet grid" }
    ],
    "testFocus": "动宾极短句精确匹配",
    "expectedTokens": [
      { "token": "去", "matchType": "exact", "labelZh": "去" },
      { "token": "厕所", "matchType": "exact", "labelZh": "厕所" }
    ],
    "minMatchRate": 1.0
  },
  {
    "id": "A4",
    "inputText": "我痛",
    "description": "2 字极短症状句（主语 + 痛感词）。两词均在种子库，期望 matchRate=1.0。",
    "evidence": [
      { "source": "SCA", "note": "失语症患者高频症状表达：主语 + 核心症状词" },
      { "source": "Widgit-26", "note": "Hemsley 26: I'm in pain / I'm uncomfortable" },
      { "source": "AsTeRICS-Hospital", "note": "Unwell grid 核心痛感词" }
    ],
    "testFocus": "核心症状词精确匹配",
    "expectedTokens": [
      { "token": "我", "matchType": "exact", "labelZh": "我" },
      { "token": "痛", "matchType": "exact", "labelZh": "痛" }
    ],
    "minMatchRate": 1.0
  },
  {
    "id": "A5",
    "inputText": "不要",
    "description": "单词快速拒绝。「不要」是种子库精确标签，否定词不拆分，期望 matchRate=1.0。",
    "evidence": [
      { "source": "SCA", "note": "快速拒绝/停止是 AAC 最基础需求之一" },
      { "source": "AsTeRICS-QC24", "note": "Quick Core 24 根板：「not」位于 24 词之列" },
      { "source": "LAMP", "note": "否定词需稳定放置，患者应能一触即达" }
    ],
    "testFocus": "否定复合词精确匹配（不拆成两词）",
    "expectedTokens": [
      { "token": "不要", "matchType": "exact", "labelZh": "不要" }
    ],
    "minMatchRate": 1.0
  },
  {
    "id": "A6",
    "inputText": "帮忙",
    "description": "单词求助。「帮忙」是种子库精确标签，期望 matchRate=1.0。",
    "evidence": [
      { "source": "SCA", "note": "单词求助是 AAC 紧急沟通核心" },
      { "source": "Widgit-26", "note": "Hemsley 26: Please call the nurse / Please call my family" },
      { "source": "Lingraphica-ICU", "note": "ICU 板块顶层 help 按钮" }
    ],
    "testFocus": "求助词精确匹配",
    "expectedTokens": [
      { "token": "帮忙", "matchType": "exact", "labelZh": "帮忙" }
    ],
    "minMatchRate": 1.0
  },
  {
    "id": "B1",
    "inputText": "我想喝水",
    "description": "基本需求句（主 + 情态动词 + 动词 + 宾语）。全词在种子库，期望 matchRate ≥ 0.9。",
    "evidence": [
      { "source": "AsTeRICS-Hospital", "note": "Need_to_drink grid 完整表达模式" },
      { "source": "2023-Mandarin", "note": "「我」「想」「喝」均在 Mandarin 100 核心词内" },
      { "source": "Lingraphica-ICU", "note": "ICU 饮水需求表达参考" }
    ],
    "testFocus": "基本需求句全精确匹配基线（Issue #56 ≥2 条基本需求要求）",
    "expectedTokens": [
      { "token": "我", "matchType": "exact", "labelZh": "我" },
      { "token": "想", "matchType": "exact", "labelZh": "想" },
      { "token": "喝水", "matchType": "exact", "labelZh": "喝水" }
    ],
    "_segmentationNote": "分词器可能产生 [我,想,喝水] 或 [我,想,喝,水]；两种路径均可精确命中",
    "minMatchRate": 0.9
  },
  {
    "id": "B2",
    "inputText": "我要去厕所",
    "description": "基本需求句含「要」（想的口语同义词）。验证 lexicon 路径：要→想。",
    "evidence": [
      { "source": "AsTeRICS-Hospital", "note": "Need_for_toilet grid 表达模式" },
      { "source": "Widgit-26", "note": "Hemsley 26: I need the toilet" },
      { "source": "SCA", "note": "「要」是失语症患者高频口语替代词" }
    ],
    "testFocus": "lexicon 路径：「要」→词库同义词→「想」图片（Issue #56 ≥2 条 lexicon 路径要求）",
    "expectedTokens": [
      { "token": "我", "matchType": "exact", "labelZh": "我" },
      { "token": "要", "matchType": "lexicon", "labelZh": "想" },
      { "token": "去", "matchType": "exact", "labelZh": "去" },
      { "token": "厕所", "matchType": "exact", "labelZh": "厕所" }
    ],
    "minMatchRate": 0.75
  },
  {
    "id": "B3",
    "inputText": "我饿了想吃饭",
    "description": "基本需求句含语气助词「了」和复合词「吃饭」。「了」应为 missing；测试分词器对「饿了」的处理。",
    "evidence": [
      { "source": "AsTeRICS-Hospital", "note": "Need_to_eat grid 场景" },
      { "source": "SCA", "note": "含语气助词是真实话语常见模式" }
    ],
    "testFocus": "语气助词「了」missing；分词挑战（Issue #56 ≥2 条含 missing token）",
    "expectedTokens": [
      { "token": "我", "matchType": "exact", "labelZh": "我" },
      { "token": "饿", "matchType": "exact", "labelZh": "饿" },
      { "token": "了", "matchType": "missing", "labelZh": null },
      { "token": "想", "matchType": "exact", "labelZh": "想" },
      { "token": "吃", "matchType": "exact", "labelZh": "吃" },
      { "token": "饭", "matchType": "missing", "labelZh": null }
    ],
    "_segmentationNote": "Intl.Segmenter 多数产生 [我,饿,了,想,吃,饭]；饭 在种子库无独立标签，missing",
    "minMatchRate": 0.6
  },
  {
    "id": "B4",
    "inputText": "我想睡觉",
    "description": "基本需求句（需要休息）。三词均在种子库，期望 matchRate=1.0。",
    "evidence": [
      { "source": "AsTeRICS-Hospital", "note": "基本需求：rest / sleep 场景" },
      { "source": "Lingraphica-ICU", "note": "ICU 常见需求：need to sleep" },
      { "source": "2023-Mandarin", "note": "「睡觉」是台湾普通话核心词高频词" }
    ],
    "testFocus": "基本需求全精确匹配（Issue #56 ≥2 条基本需求要求）",
    "expectedTokens": [
      { "token": "我", "matchType": "exact", "labelZh": "我" },
      { "token": "想", "matchType": "exact", "labelZh": "想" },
      { "token": "睡觉", "matchType": "exact", "labelZh": "睡觉" }
    ],
    "minMatchRate": 1.0
  },
  {
    "id": "B5",
    "inputText": "帮我叫护士",
    "description": "求助 + 人物词。「帮」通过 lexicon 路径命中「帮忙」；「叫」「护士」精确匹配。",
    "evidence": [
      { "source": "Widgit-26", "note": "Hemsley 26: Please call the nurse — 高优先级医院求助" },
      { "source": "AsTeRICS-Hospital", "note": "Nurse grid / call for help 场景" },
      { "source": "SCA", "note": "帮忙 + 人物词是 SCA 求助句式" }
    ],
    "testFocus": "lexicon 路径：「帮」→「帮忙」（Issue #56 lexicon 路径测试）",
    "expectedTokens": [
      { "token": "帮", "matchType": "lexicon", "labelZh": "帮忙" },
      { "token": "我", "matchType": "exact", "labelZh": "我" },
      { "token": "叫", "matchType": "exact", "labelZh": "叫" },
      { "token": "护士", "matchType": "exact", "labelZh": "护士" }
    ],
    "minMatchRate": 1.0
  },
  {
    "id": "C1",
    "inputText": "我头很痛",
    "description": "症状句含程度副词「很」。「头」「痛」精确命中；「很」为 missing。",
    "evidence": [
      { "source": "AsTeRICS-Hospital", "note": "Unwell / pain location grid" },
      { "source": "Widgit-26", "note": "Hemsley 26: I'm in pain (location modifier)" }
    ],
    "testFocus": "症状双词精确匹配 + 程度副词 missing（Issue #56 ≥2 条医疗/症状场景）",
    "expectedTokens": [
      { "token": "我", "matchType": "exact", "labelZh": "我" },
      { "token": "头", "matchType": "exact", "labelZh": "头" },
      { "token": "很", "matchType": "missing", "labelZh": null },
      { "token": "痛", "matchType": "exact", "labelZh": "痛" }
    ],
    "minMatchRate": 0.7
  },
  {
    "id": "C2",
    "inputText": "肚子疼",
    "description": "腹痛短句。「肚子」精确命中；「疼」走 lexicon 路径（疼是「痛」同义词）。",
    "evidence": [
      { "source": "AsTeRICS-Hospital", "note": "Unwell / stomach pain grid" },
      { "source": "SCA", "note": "「肚子疼」是患者高频症状短句" }
    ],
    "testFocus": "同义词 lexicon 路径：「疼」→词库→「痛」图片",
    "expectedTokens": [
      { "token": "肚子", "matchType": "exact", "labelZh": "肚子" },
      { "token": "疼", "matchType": "lexicon", "labelZh": "痛" }
    ],
    "_segmentationNote": "若分词器产生 [肚子疼] 整体 token，则 Strategy 4 partial 命中「肚子」；两路径均合法",
    "minMatchRate": 1.0
  },
  {
    "id": "C3",
    "inputText": "我发烧了",
    "description": "症状句含语气助词「了」。「发烧」精确命中；「了」为 missing。",
    "evidence": [
      { "source": "AsTeRICS-Hospital", "note": "Something_is_wrong / fever grid" },
      { "source": "Lingraphica-ICU", "note": "ICU 症状：fever 是高优先级症状" }
    ],
    "testFocus": "症状词精确匹配 + 语气助词 missing",
    "expectedTokens": [
      { "token": "我", "matchType": "exact", "labelZh": "我" },
      { "token": "发烧", "matchType": "exact", "labelZh": "发烧" },
      { "token": "了", "matchType": "missing", "labelZh": null }
    ],
    "minMatchRate": 0.6
  },
  {
    "id": "C4",
    "inputText": "我头晕",
    "description": "症状句（头晕是脑卒中后遗症高频症状）。两词均在种子库，期望 matchRate=1.0。",
    "evidence": [
      { "source": "AsTeRICS-Hospital", "note": "Unwell / dizzy grid" },
      { "source": "Aphasia-Best-Practice", "note": "脑卒中患者最常见主诉症状之一" }
    ],
    "testFocus": "症状精确匹配（Issue #56 医疗场景）",
    "expectedTokens": [
      { "token": "我", "matchType": "exact", "labelZh": "我" },
      { "token": "头晕", "matchType": "exact", "labelZh": "头晕" }
    ],
    "minMatchRate": 1.0
  },
  {
    "id": "C5",
    "inputText": "我咳嗽",
    "description": "症状句（咳嗽是常见肺部症状）。两词均在种子库，期望 matchRate=1.0。",
    "evidence": [
      { "source": "AsTeRICS-Hospital", "note": "Something_is_wrong / cough grid" }
    ],
    "testFocus": "症状精确匹配（Issue #56 医疗场景）",
    "expectedTokens": [
      { "token": "我", "matchType": "exact", "labelZh": "我" },
      { "token": "咳嗽", "matchType": "exact", "labelZh": "咳嗽" }
    ],
    "minMatchRate": 1.0
  },
  {
    "id": "C6",
    "inputText": "我胸口疼",
    "description": "胸痛症状句。「胸口」精确命中；「疼」走 lexicon 路径。也可测 partial 路径（若分词器产生「胸口疼」整体 token）。",
    "evidence": [
      { "source": "AsTeRICS-Hospital", "note": "Something_is_wrong / chest pain — 高优先级急症场景" },
      { "source": "Lingraphica-ICU", "note": "ICU 胸部症状表达" }
    ],